<?xml version="1.0" encoding="utf-8"?>
<EventType catalogName="DataLoggerConfigured" xmlns:xsi="http://www.w3.org/2001/XMLSchema-instance" xsi:noNamespaceSchemaLocation="..\..\xsd\EventType.xsd">
	<Attributes>
		<Attribute reuseable="false" catalogName="LoggerId">
			<DataType multiValue="false" catalogName="String">
				<RuntimeType>System.Int32</RuntimeType>
			</DataType>
			<Name>LoggerId</Name>
			<Mandatory>true</Mandatory>
		</Attribute>
		<Attribute reuseable="false" catalogName="DateTime">
			<DataType multiValue="false" catalogName="DateTime">
				<RuntimeType>System.DateTime</RuntimeType>
			</DataType>
			<Name>DateTime</Name>
			<Mandatory>true</Mandatory>
		</Attribute>
		<Attribute reuseable="false" catalogName="OrderId">
			<DataType multiValue="false" catalogName="String">
				<RuntimeType>System.Int32</RuntimeType>
			</DataType>
			<Name>OrderId</Name>
			<Mandatory>true</Mandatory>
		</Attribute>
		<Attribute reuseable="false" catalogName="Destination">
			<DataType multiValue="false" catalogName="String">
				<RuntimeType>System.String</RuntimeType>
			</DataType>
			<Name>Destination</Name>
			<Mandatory>true</Mandatory>
		</Attribute>
		<Attribute reuseable="false" catalogName="MinTemp">
			<DataType multiValue="false" catalogName="String">
				<RuntimeType>System.String</RuntimeType>
			</DataType>
			<Name>MinTemp</Name>
			<Mandatory>true</Mandatory>
		</Attribute>
		<Attribute reuseable="false" catalogName="MaxTemp">
			<DataType multiValue="false" catalogName="String">
				<RuntimeType>System.String</RuntimeType>
			</DataType>
			<Name>MaxTemp</Name>
			<Mandatory>true</Mandatory>
		</Attribute>
		<Attribute reuseable="false" catalogName="SenseInterval">
			<DataType multiValue="false" catalogName="String">
				<RuntimeType>System.Int32</RuntimeType>
			</DataType>
			<Name>SenseInterval</Name>
			<Mandatory>true</Mandatory>
		</Attribute>
		<Attribute reuseable="false" catalogName="Staffmember">
			<DataType multiValue="false" catalogName="String">
				<RuntimeType>System.String</RuntimeType>
			</DataType>
			<Name>Staffmember</Name>
			<Mandatory>true</Mandatory>
		</Attribute>
	</Attributes>
	<AllowUnknownAttributes>false</AllowUnknownAttributes>
	<ImplementationType>Eventis.Core.Event.BaseEvent</ImplementationType>
</EventType>