<?xml version="1.0" encoding="UTF-8"?>
<EventType catalogName="ContactsProvider" xmlns:xsi="http://www.w3.org/2001/XMLSchema-instance" xsi:noNamespaceSchemaLocation="..\..\xsd\EventType.xsd">
	<Attributes>
		<Attribute reuseable="false" catalogName="CustomerId">
			<DataType multiValue="false" catalogName="String">
				<RuntimeType>System.Int32</RuntimeType>
			</DataType>
			<Name>CustomerId</Name>
			<Mandatory>true</Mandatory>
		</Attribute>
		<Attribute reuseable="false" catalogName="DateTime">
			<DataType multiValue="false" catalogName="DateTime">
				<RuntimeType>System.DateTime</RuntimeType>
			</DataType>
			<Name>DateTime</Name>
			<Mandatory>true</Mandatory>
		</Attribute>
		
		<Attribute reuseable="true" catalogName="ContactInfo">
			<DataType multiValue="false" catalogName="ContactInfo">
				<RuntimeType catalogName="ContactInfo"/>
			</DataType>
			<Name>ContactInfo</Name>
			<Mandatory>true</Mandatory>
		</Attribute>
		
		</Attributes>
	<AllowUnknownAttributes>false</AllowUnknownAttributes>
	<ImplementationType>Eventis.Core.Event.BaseEvent</ImplementationType>
</EventType>
